title,published_at,NMF_topic,NMF_score
"AI For Cybersecurity Is Advancing, But Users Need To Trust It",2025-07-17 23:06:05,2,0.0010258168127247637
"India-US Trade Deal: Both Sides Trying To Iron Out Issues, Says MEA",2025-07-17 23:02:39,2,0.048547753237604914
"Damian Lillard to reunite with Trail Blazers on 3-year, $42M deal: Report",2025-07-17 23:02:04,2,0.07955055497108064
"Damian Lillard to reunite with Trail Blazers on 3-year, $42M deal: Report",2025-07-17 23:02:04,2,0.07955055497108064
"Suns, Wolves Discussed Rudy Gobert, Donte DiVinenzo, Terrence Shannon, No. 17 For Kevin Durant",2025-07-17 22:52:20,2,0.002028464101079884
Padres linked to MLB insiders' 'least valuable player' at trade deadline,2025-07-17 22:51:58,2,0.2377732606644782
US Trade Partners Are Trying to Get Around Trump’s Tariffs,2025-07-17 22:50:17,2,0.07984418989098481
"Bradley Beal's Decision To Leave Suns For Clippers 'About Basketball', Avoiding Another Lost Season",2025-07-17 22:40:41,2,0.0280368827137366
"Stock market today: Dow, S&P 500, Nasdaq futures inch higher ahead of tech earnings as tariff deadline looms",2025-07-21 05:27:53,2,0.06650063712356179
"Eugenio Suárez, one of MLB's most coveted trade candidates, is playing so well the Diamondbacks may not sell",2025-07-21 04:46:42,2,0.07045063847293284
Lakers Linked to Potential Trade for 2-Time All-Star Guard,2025-07-21 04:22:11,2,0.13706647385255194
How Trump’s arms shipments to Ukraine differ from Biden’s schemes,2025-07-21 04:06:37,1,0.0067698138218866355
PM Shigeru Ishiba’s future up in the air after election loss to populists,2025-07-21 04:02:29,2,0.002850307905277949
"Trump, Xi  may meet ahead of or during APEC summit October: report",2025-07-21 04:00:40,2,0.037000535889037574
More FAFO: Arkansas Farms Filing For Bankruptcy Due To Trump,2025-07-21 03:48:33,1,0.050524496444230134
Japan election results: Prime Minister Shigeru Ishiba to be removed soon? Question rises after ruling coalition loses Sunday's vote,2025-07-21 03:48:18,1,0.02233608254333938
Commerce Secretary Lutnick Confident About Reaching EU Trade Deal | WSJ News,2025-07-21 03:39:17,1,0.0708244723607799
"MLB trade deadline rumors: Yankees, Red Sox eye same team; Phillies bring back old friend; no Braves teardown",2025-07-21 03:34:40,2,0.19847025925765435
Phillies reunite with 15-year MLB veteran on free agent deal,2025-07-21 03:33:58,2,0.07658542555145807
"After effectively banning porn, Idaho state government shows visitors porn",2025-07-21 03:16:15,1,0.0020809260284564294
Dodgers Pursuing High-End Bullpen Upgrades,2025-07-21 03:10:13,2,0.029512634465543832
3 reasons why investors have largely ignored Trump’s tariff threats as Aug. 1 deadline approaches,2025-07-21 03:07:51,2,0.05497985382063233
Japanese Prime Minister Shigeru Ishiba’s future is in doubt after disastrous loss in upper-house election,2025-07-21 03:00:13,1,0.0036871361574454947
"PM Modi to visit Britain, Maldives",2025-07-21 03:00:00,2,0.003943360817229548
Former Outspoken Eagles Star Sends Message on Social Media,2025-07-21 02:58:38,2,0.03219613147536796
Five Key Charts to Watch in Global Commodity Markets This Week,2025-07-21 02:53:21,2,0.006013811063700788
Japan PM's Future In Doubt After Election Debacle,2025-07-21 02:51:07,1,0.033965656276248306
Commerce chief Lutnick insists Aug. 1 is ‘hard deadline’ for EU and tariffs: ‘They’re going to start paying’,2025-07-21 02:43:39,1,0.01870295609944993
Should You Buy A Car Through Costco? Here's What The Auto Program Actually Offers,2025-07-21 02:35:00,2,0.004064754921028945
Trump’s ‘America First’ Policies Are Diminishing U.S. Global Influence,2025-07-21 02:30:00,2,0.0009931743830182446
Japan PM laments 'harsh' election result as upper house control slips,2025-07-21 02:24:07,1,0.028599148736388896
Seahawks cut veteran TE Fant after 3 seasons,2025-07-21 02:21:14,2,0.011650092649982641
Sources: Chiefs lock up Karlaftis with 4-year deal,2025-07-21 02:21:14,1,0.055643208929283976
Chargers just had door swing wide open to make major offensive addition,2025-07-21 02:05:12,2,0.04472586265814718
Howard Lutnick Claims Tariffs Will Spark Up to 1.5 GDP Growth,2025-07-21 01:59:32,1,0.026046898811617692
Increasing union loudness comes at same time health workers are in pay talks with SA government,2025-07-21 01:35:06,2,0.008888141375349882
Japanese PM faces worst election result since 1999,2025-07-21 01:27:27,1,0.004927581119716915
Padres get a bittersweet update on availability of Braves' Sean Murphy,2025-07-21 01:22:25,2,0.03332072199268353
Brewers PBO Matt Arnold Downplays Freddy Peralta Trade Possibilities,2025-07-21 00:47:55,2,0.04499347644215332
Samsung’s Secret Galaxy Z Fold 7 Deal Sneaks to $899,2025-07-21 00:45:04,1,0.05241477925712574
These cars are losing value fast — that’s GREAT news for used EV buyers!,2025-07-21 00:35:31,2,0.004566783987874277
Would Keenan Allen even want to come back to the Chargers?,2025-07-21 00:21:21,2,0.00122591305908137
Guardians reveal firm stance on potential Emmanuel Clase trade,2025-07-21 00:16:06,2,0.08813736308089987
"News Analysis: Britain's job market sliding under rising labor cost, U.S. tariff threat",2025-07-21 00:14:00,1,0.030238903624021766
"Cardinals Sonny Gray, Miles Mikolas Reveal Trade Decision After Ongoing Buzz: Report",2025-07-21 00:11:01,2,0.09259885587012644
"Update on Jonathan Kuminga, Warriors as well as updates on Giddey, Thomas, Grimes restricted free agency",2025-07-20 22:57:14,2,0.018850460947291363
ET Analysis: India counters China’s fertilizer export freeze with diplomatic push,2025-07-21 00:04:56,1,0.0072570360870534995
U.S. commerce secretary dismisses question that free trade with Canada is dead,2025-07-20 23:46:44,2,0.06550776842397785
U.S. commerce secretary dismisses question that free trade with Canada is dead,2025-07-20 23:40:48,2,0.06550776842397785
Keenan Allen is not the only former player Chargers should bring back to complete roster,2025-07-20 23:37:32,2,0.009179314762900412
Commerce Secretary Lutnick Says He Is Confident U.S. Will Secure Trade Deal With EU,2025-07-20 23:35:27,1,0.111151596918949
Britain waves the white flag to Islamization and illegal immigration,2025-07-20 23:33:07,2,0.0014540329204597024
Cardinals starters unlikely to waive no-trade clauses,2025-07-20 23:32:15,2,0.014416024246444045
Insider reveals 3 players the Braves are shopping ahead of trade deadline,2025-07-20 23:27:25,2,0.17818785287489464
Do Africa’s leaders have a ‘game plan’ to deal with Trump?,2025-07-20 23:23:57,1,0.0891891172802239
Lakers cut ties with recently-acquired 6-foot-5 guard after Marcus Smart news,2025-07-20 23:20:31,2,0.03623187472936614
Braves $65 Million Star Reportedly 'Available' In Potential Trade Deadline Blockbuster,2025-07-20 23:14:01,2,0.2707083426016747
SPACs Are Back - You Should Be Worried,2025-07-20 23:11:08,3,1.5542572577420633e-26
"Lutnick on Trump's tariff deals: Next two weeks will be ""for the record books""",2025-07-20 22:55:14,1,0.043124113275652146
A’s Rebuffing Trade Interest In Mason Miller,2025-07-20 22:49:18,2,0.08922040372419743
China’s rare earth magnet exports to US surge 660% after breakthrough trade deal,2025-07-20 22:44:19,1,0.06018731645003573
"EU Sanctions Against India’s Nayara ‘Unjustified,’ Rosneft Says",2025-07-20 22:34:03,1,0.0511514635328779
"JP Morgan Chase Have A Point, But The Whole Economy Needs Data To Flow",2025-07-20 22:26:46,1,0.0026839534386990994
"Japan ruling party's election loss is in the price, investors say",2025-07-20 22:20:14,1,0.03512057102725151
"Lutnick says EU deal near, signals tariff shake-up",2025-07-20 22:17:07,1,0.1534738455833089
"Transcript: Rep. Jim Himes on ""Face the Nation with Margaret Brennan,"" July 20, 2025",2025-07-20 22:07:12,2,0.004711472081854577
"Transcript: Commerce Secretary Howard Lutnick on ""Face the Nation with Margaret Brennan,"" July 20, 2025",2025-07-20 22:03:36,2,0.010084535404380602
Lutnick says U.S.-EU trade deal possible before August 1 tariff deadline,2025-07-20 21:34:58,1,0.13115082336204953
Braves Predicted To Cut Ties With $14 Million Pitcher In Trade Deadline Deal,2025-07-20 21:30:01,2,0.266690131230747
Lakeland-owner Hilco eyes swoop for stricken jeweller Claire's,2025-07-20 21:27:00,1,0.0024564681872150267
Commerce Secretary Lutnick says he is confident US will secure trade deal with EU,2025-07-20 21:14:25,1,0.111151596918949
Cardinals Make $260 Million Nolan Arenado Trade Decision: Report,2025-07-20 21:14:01,2,0.17481997290431203
"Former Phillies Pitcher, Longtime Coach Dies Unexpectedly at 63",2025-07-20 21:07:34,2,0.02282733325473381
How one clause sparked Exxon-Chevron feud that turned personal,2025-07-20 21:04:43,2,0.0015208859279784274
"How to draft 49ers players in 2025 Fantasy leagues: Brandon Aiyuk and Ricky Pearsall placed on PUP, more",2025-07-20 21:03:37,2,0.008999025503709696
Intra-Division Mock Trade Sends $8 Million Slugger To Desperate Red Sox,2025-07-20 20:59:40,2,0.16595820197517597
Fuel Distribution & Marketing Industry - USA,2025-07-20 20:56:56,2,0.0011193901470091371
President Andrew Jackson to 21st Century America: “I told you so.”,2025-07-20 20:47:54,2,0.0024101813230565346
Trump celebrates 6 months back in office: US 'totally revived' after being 'DEAD' under Biden,2025-07-20 20:45:42,1,0.06220556711336703
"Portfolio newsletter- July 20, 2025",2025-07-20 20:42:54,2,0.006534693851546609
"Shigeru Ishiba, Japan's Rapidly Diminishing PM",2025-07-20 20:42:19,1,0.0018484931613374387
Cardinals 'Remain Undecided' On Trading $81 Million Star Pitcher,2025-07-20 20:39:01,2,0.13810033634443394
"Shigeru Ishiba, Japan’s rapidly diminishing PM",2025-07-20 20:37:20,1,0.0018484931613374387
Nationals Not Planning To Trade From Young Core At Deadline,2025-07-20 20:05:01,2,0.1267268949227684
Clearance pricing now live on the 2024 Samsung Galaxy Watch Ultra at 50% off for today only,2025-07-20 19:54:49,2,0.0026137231272217224
Yankees Linked To $66 Million Slugger As Trade Buzz Reaches New Peak,2025-07-20 19:49:01,2,0.16488180440996628
United States Soccer Phenom Ignites Petty Beef With His Contentious Celebration After Abrupt Dismissal,2025-07-20 19:34:18,2,0.0006535436537010907
Trump and Xi tipped to meet ahead of or during Apec summit in South Korea,2025-07-20 19:33:51,1,0.040984946686228846
Mets Blockbuster? Why Latest Mason Miller Trade Rumors Make Some Sense,2025-07-20 19:15:01,2,0.16333402312381398
Appeals and negotiations won’t make Israel stop starving Gaza,2025-07-20 19:11:33,2,0.03294271401641659
Trump defied the world with truth — and upended the status quo,2025-07-20 19:03:59,1,0.04288378870139629
How One Clause Sparked Exxon-Chevron Feud That Turned Personal,2025-07-20 18:50:17,2,0.0015208859279784274
"Carney’s new measures to protect Canadian steel, Couche-Tard pulls 7-Eleven parent bid and GO Residential launches rare IPO: Must-read business and investing stories",2025-07-20 18:44:59,2,0.012566290501022249
7 things I wish I knew when I started self-hosting LLMs,2025-07-23 03:30:22,2,0.0020849927025120498
The Doug Ford Doctrine: 'We really have to flex our muscles',2025-07-20 18:30:36,1,0.0008359772877371088
Why My Mobile Hotspot May Be Better Than My Home Internet,2025-07-20 18:30:07,2,0.002362774349005681
Japan's Ishiba vows to stay on after election defeat,2025-07-20 18:18:00,2,0.005157469994488765
Japan's Ishiba faces difficult election amid far-right surge,2025-07-20 18:18:00,2,0.021175568209008965
MLB Writer Expects Braves Will Trade $58 Million Star Pitcher at Deadline,2025-07-20 18:15:01,2,0.27212617765600394
Justice Department Urges Dismissal Of Maryland Climate Lawsuits,2025-07-20 18:00:46,1,0.0012658369349233482
Bestbuy TP-Link Tri-Band BE9700 Archer BE600 WiFi 7 Network $170 with any old router trade inRouter (5 replies),2025-07-20 17:50:03,2,0.047711189651943015
EU to Prepare Retaliation Plan as US Trade Stance Seen to Harden (Alberto Nardelli/Bloomberg),2025-07-20 17:40:01,2,0.05515411689965225
South Korea national security adviser travels to Washington ahead of tariff deadline,2025-07-20 17:37:00,2,0.07606454345941625
South Korea national security adviser travels to Washington ahead of tariff deadline,2025-07-20 17:34:16,2,0.07606454345941625
5 NFL Offseason Moves That Teams Will Regret,2025-07-20 17:30:00,2,0.0218394567555372
Trump says trade deal struck with Japan includes 15% tariff,2025-07-23 05:29:00,1,0.23603338112794883
Trump sets 15% tariff on Japanese imports as part of investment agreement,2025-07-23 05:27:01,1,0.10329225041893417
Dollar holds losses against yen after Trump announces Japan trade deal,2025-07-23 05:26:26,1,0.2200232845658611
Dollar under pressure against yen after Trump announces Japan trade deal,2025-07-23 05:26:26,1,0.22649624242632635
Dollar holds losses after Trump announces Japan trade deal,2025-07-23 05:26:26,1,0.23847625064222908
'Sensitive' Memo Reveals How Many Border Agents Trump Is Using For Immigration Raids,2025-07-23 05:26:13,1,0.04011182702550044
Dollar holds losses against yen after Trump announces Japan trade deal,2025-07-23 05:24:00,1,0.2200232845658611
"Japan could be in a weaker position in trade talks after Ishiba's upper house defeat, experts say",2025-07-23 05:22:17,2,0.05778171314521764
Trump announces 'massive' trade deal with Japan,2025-07-23 05:22:17,1,0.343013642099001
"Trump announces ‘massive’ trade deal with Japan, tariff rate set at 15%",2025-07-23 05:22:05,1,0.26323268009924006
"Japan PM Ishiba weighs whether to step down over US trade talks, Yomiuri says",2025-07-23 05:20:00,1,0.0736421693772192
Former Laker says being traded to Mavericks was best moment of his career,2025-07-23 05:19:56,1,0.026075923948541465
"Guardians Make Steven Kwan Trade Decision Amid Rumors, Per Insider",2025-07-23 05:19:48,2,0.12603814881832223
Braves Reportedly Make Sean Murphy Trade Decision Amid Struggles,2025-07-23 05:17:54,2,0.1359319452087541
Trump says a China trip is ‘not too distant’ as trade tensions ease,2025-07-23 05:14:51,1,0.11382985615211723
Trump announces ‘massive’ trade agreement with Japan | CNN Business,2025-07-23 05:14:11,1,0.1821320335845115
"Philippines goods to face 19% tariff, Trump says",2025-07-23 05:13:44,1,0.14041586366363823
Asia stock market live updates: U.S.-Japan trade deal,2025-07-23 05:12:08,1,0.08314987942194818
Ford praises Carney after late-night fireside chats at Muskoka cottage,2025-07-23 05:11:44,1,0.002021662847859816
Trump announces ‘massive’ trade agreement with Japan,2025-07-23 05:11:21,1,0.24310063522462774
Japan and U.S. reach tariff deal with ‘reciprocal’ rate at 15%,2025-07-23 05:11:19,1,0.16432701647704012
"Trump announces trade deal with Japan, including 15% reciprocal tariff",2025-07-23 05:11:18,1,0.26085967891946077
Oil Edges Higher With Progress in US Trade Talks in Spotlight,2025-07-23 05:11:17,2,0.06870649859089627
Trump says US and Japan have reached trade deal,2025-07-23 05:11:07,1,0.26076559052405257
Trump announces 'massive' trade deal with Japan with 15% reciprocal tariffs,2025-07-23 05:06:35,1,0.285636014534811
Trump Announces ‘Massive’ Trade Deal with Japan,2025-07-23 05:05:00,1,0.343013642099001
"Indonesia to cut tariffs, non-tariff barriers in US trade deal, Trump official says",2025-07-23 05:04:00,1,0.1732142167594537
US-Philippines trade talks yield modest tariff shift after Trump-Marcos meeting,2025-07-23 05:02:10,2,0.06064924899606978
"Trump announces trade deal with Japan, including 15% tariff",2025-07-23 05:00:09,1,0.2965018877504123
Trump announces 'massive' trade deal with Japan with 15% reciprocal tariffs,2025-07-23 05:00:05,1,0.285636014534811
Japan and U.S. reach tariff deal with ‘reciprocal’ rate at 15%,2025-07-23 05:00:00,1,0.16432701647704012
"Trump announces trade deal with Japan, including 15% tariff",2025-07-23 04:58:00,1,0.2965018877504123
Trump announces $550 billion trade deal with Japan.,2025-07-23 04:55:29,1,0.2678127090267974
Manitoba and Saskatchewan sign agreement to boost trade corridor through the Arctic,2025-07-23 04:50:49,2,0.055018583332015654
"Vietnam Stocks Near Record on Reform Hopes, Trade Deal Optimism",2025-07-23 04:48:55,1,0.06015483805918032
Carney tells premiers he'll only sign a U.S. trade deal 'in the best interest of Canadians',2025-07-23 04:45:15,1,0.06221602540339081
"Breaking down U.S. trade agreement with Philippines, Indonesia deal",2025-07-23 04:42:49,1,0.16422239223432397
Knicks executive reveals plan for possible Mikal Bridges extension,2025-07-23 04:38:24,2,0.06446191673219014
US-Philippines trade talks yield modest tariff shift after Trump-Marcos meeting - Reuters,2025-07-23 04:25:30,2,0.05621796808814327
Asian Traders Optimistic as S&P 500 Record Holds: Markets Wrap,2025-07-23 04:21:41,1,0.004276075353450299
"Japan could be in a weaker position in trade talks after Ishiba's upper house defeat, experts say",2025-07-23 04:18:31,2,0.05778171314521764
The Administration Wants Military Women to Know Their Place,2025-07-23 04:18:00,3,0.017509695728107434
"Japan’s Trade Negotiator Heads Into Meeting With Trump, NHK Says",2025-07-23 04:15:41,1,0.05245276555177797
Ford and Smith divided over Trump response at premiers’ summit,2025-07-23 04:13:44,1,0.04792554313672295
"Indonesia to cut tariffs, non-tariff barriers in US trade deal, Trump official says",2025-07-23 04:13:00,1,0.1732142167594537
"Lakers have not done enough during offseason to give LeBron James, Luka Doncic a championship contender team",2025-07-23 04:09:30,2,0.03547536704750757
Seattle faces nation’s worst inflation as living costs soar,2025-07-23 04:07:59,1,0.0012948384113385797
"Trump Meets Marcos, Knocks 1% Off Tariff Rate",2025-07-23 04:01:03,1,0.10334283006972787
"White House releases U.S.-Indonesia trade deal framework, final talks underway",2025-07-23 03:42:09,1,0.06741282164263634
Terry McLaurin doesn’t report to camp while waiting for a contract extension - NBC Sports,2025-07-23 03:42:06,2,0.08253151709943615
Guardians' All-Star outfielder linked to Phillies at trade deadline,2025-07-23 03:41:19,2,0.208437589032135
What do we know about Donald Trump's visit to Scotland?,2025-07-23 03:37:30,2,0.006707623253746998
Trump says a China trip is ‘not too distant’ as trade tensions ease,2025-07-23 03:37:12,1,0.11382985615211723
Commentary: Will Indonesia regret its trade deal with Trump?,2025-07-23 03:30:00,1,0.167203291202937
Wall Street Bets on U.S. Graphite as China Faces 160% Tariffs,2025-07-23 03:30:00,1,0.023877880651804382
Sources: Unhappy McLaurin a no-show at camp - ESPN,2025-07-23 03:24:17,2,0.03084384572120179
"‘The More Rescissions, the Merrier’: Hill Conservatives Hail Plan for Cuts to Education Department Funding",2025-07-23 03:21:01,2,0.0033502150083173157
"U.S. Strikes Trade Deals With Philippines, Indonesia as Tariff Deadline Nears",2025-07-23 03:20:59,2,0.1395082314966219
Powell Ouster Threat Boosts Bond Market’s ‘Cleanest’ Trade,2025-07-23 03:19:41,2,0.05428306843645224
"White House releases U.S.-Indonesia trade deal framework, final talks underway",2025-07-23 03:18:38,1,0.06741282164263634
Hopes and Fears for President Trump’s AI Action Plan,2025-07-23 03:18:26,3,0.021543382452973842
Why this American vassal is suddenly defying its master,2025-07-23 03:14:11,3,0.002155000305333809
CNN’s Abby Phillip Roasts Trump’s Trade Deal Boasts With Blistering Montage,2025-07-23 03:14:11,1,0.05084199772906622
"Trump announces new trade ""deal"": Americans to begin paying a 19% tax on all goods imported from the Philippines, while residents of the Philippines will get to import American made products tax free. So much great againness [Dumbass]",2025-07-23 03:08:17,1,0.07082339043907668
Athletics Recall Carlos Cortes For MLB Debut,2025-07-23 03:00:14,2,0.05041336549072817
Live: ASX set for strong gains as Wall St ekes out fresh record,2025-07-23 02:55:02,3,0.08409835072000693
Trump announces trade agreement with the Philippines and terms of deal with Indonesia,2025-07-23 02:54:51,1,0.24134810801401058
28 Countries Slam Israel’s ‘Inhumane Killing of Civilians’ in Gaza,2025-07-23 02:54:19,1,0.0032392419180777877
Trump says US will charge 19% tariff on goods from Philippines,2025-07-23 02:51:03,1,0.14562176915602884
Trump says deal reached with Philippines on tariffs - Politico,2025-07-23 02:45:24,1,0.17444955334162604
Two Genius Signings The Milwaukee Bucks Made This Offseason,2025-07-23 02:45:06,2,0.00740541471942882
"Sales of U.S. spirits in Canada plunge 66%, industry groups say",2025-07-23 02:45:02,2,0.006692325762568284
MLB trade deadline: Top 26 players who could be traded between now and July 31,2025-07-23 02:40:52,2,0.1314949076160888
"Trading Day: Tech cools, Trump's Fed ire burns",2025-07-23 02:35:53,2,0.007343953616161589
Mets Prioritizing Bullpen Help,2025-07-23 02:32:44,2,0.016333136574278442
"Amazon acquires Bee, the AI wearable that records everything you say | TechCrunch",2025-07-23 02:22:34,2,0.0045819250110440265
Indonesia trade deal will remove critical-mineral export restrictions: WH,2025-07-23 02:15:39,1,0.11321691257610056
"B.C. inks trade deals with Manitoba, Yukon a day after agreement with Ontario",2025-07-23 01:57:20,2,0.06223925772613853
Insider Drops Massive Update on Commanders WR Terry McLaurin,2025-07-23 01:56:00,2,0.07606512977034442
Terry McLaurin Reportedly Not In Attendance For First Day Of Commanders' Camp,2025-07-23 01:51:47,2,0.05963219576933047
49ers: Jennings hasn't formally asked for trade,2025-07-23 01:50:51,2,0.07380842463062584
Guess Trump Still Not Over That Time Obama Laughed He Was A Loser Right To His Face!,2025-07-23 01:50:15,1,0.04459599729999992
Cleveland Guardians trade proposal tags Emmanuel Clase to the Yankees,2025-07-23 01:49:24,2,0.09057357639646181
Russia Faces Coordinated U.S.-EU Crackdown as Oil Sanctions Escalate,2025-07-23 01:30:00,1,0.007901928147381504
Longest NFL rookie holdouts: Where Bengals' Shemar Stewart ranks on list,2025-07-23 01:25:49,2,0.00875650268480982
US Sees $50 Billion in Indonesia Market Access Under Trump Deal,2025-07-23 01:18:46,1,0.16208454140740358
Oil Slips for Third Straight Session,2025-07-23 01:17:23,2,0.0034774435976973658
Trump Administration Keeps 19 Percent Tariff on Indonesia in Trade Deal,2025-07-23 01:17:08,1,0.22393952811380258
Trump sets 19% tariff on Philippines in new trade deal,2025-07-23 01:09:44,1,0.20437060714974956
"Sales of U.S. spirits in Canada plunge 66%, industry groups say",2025-07-23 01:06:30,2,0.006692325762568284
Beal's assist: Clips guard to give up No. 3 to CP3,2025-07-23 01:05:47,2,0.008609637528707425
"Indonesia to cut tariffs, non-tariff barriers in US trade deal, Trump official says",2025-07-23 01:05:24,1,0.1732142167594537
49ers head coach Kyle Shanahan denies breakout star requested trade,2025-07-23 01:04:48,2,0.0650905335283557
"49ers WR Jauan Jennings hasn’t formally requested a trade, expected to start camp amid push for new contract",2025-07-23 01:04:01,2,0.05168954336392804
SOS — Save Our Shipping: Trump must break China’s chokehold on global trade,2025-08-01 05:29:58,1,0.06287153949766647
A smart fit in a shifting core,2025-08-01 05:29:30,2,0.005444197345046167
"Trump Sets Tariffs Before Deadline With 10%, 15% Baseline Rates",2025-08-01 05:28:29,1,0.06910544574388577
Aaron Boone Makes Yankees' Closer Decision After Trade Deadline Additions,2025-08-01 05:28:11,2,0.13612891527343948
Rams defender recruiting All-Pro wide receiver to Los Angeles,2025-08-01 05:27:12,2,0.01679707166491989
The Hidden Logic to Trump’s Trade Deals Revolves Around China,2025-08-01 05:23:33,2,0.07692740019257695
"Knicks, Mikal Bridges agree to 4-year, $150 million extension",2025-08-01 05:22:00,2,0.12351957149344883
Mikal Bridges contract extension: Why crucial compromise with Knicks should benefit both sides,2025-08-01 05:18:55,2,0.046932479375164975
"MLB trade tracker: Every major move from busy 2025 deadline as Yankees, Astros, Padres, more make upgrades",2025-08-01 05:13:31,2,0.22315207761462705
NHL Trade Buzz: Connor McDavid’s future unclear as Oilers maintain wait-and-see stance while contract runs out,2025-08-01 05:09:27,2,0.06289151139693372
Government to discuss impact of EU-US trade deal,2025-08-01 05:07:36,1,0.07901824150327483
Dozens of countries with no deals face higher tariffs as trade deadline nears,2025-08-01 05:07:35,2,0.1324179093109099
'World's Leading Trump Whisperer' Sheinbaum Gets Another 90 Days for Tariff Talks,2025-08-01 05:07:22,1,0.09005272426555343
The Freddy Fermin Trade We’ve All Been Waiting For,2025-08-01 05:05:04,2,0.07002319756321404
'Lies!' Nobel economist Paul Krugman slams media for endorsing Trump’s 'pure fantasy',2025-08-01 05:04:56,2,0.0009135009113327392
7/31 The Takeout with Major Garrett,2025-08-01 05:04:02,3,0.012039783567292196
Trade Grades: Carlos Correa rejoins Astros in stunning trade with Twins - The New York Times,2025-08-01 05:02:24,2,0.15057995695633497
"Dodgers pass MLB trade deadline quietly, add Brock Stewart and Alex Call",2025-08-01 05:00:25,2,0.1660493672188029
"MLB trade deadline winners and losers: Padres go big, Yankees, Mets, Phillies load up, Tigers stay quiet",2025-08-01 04:55:14,2,0.17334451832972803
Terry McLaurin Wants Trade as Commanders Reportedly Reject $30 Million Salary,2025-08-01 04:54:26,2,0.15358252065148623
Trump’s tariffs are not authorized by Congress,2025-08-01 04:52:02,1,0.02257665947257992
"Fantasy Baseball Trade Deadline Tracker: Yankees add David Bednar, Camilo Doval; Mason Miller joins Padres",2025-08-01 04:50:11,2,0.14554246144812852
Terry McLaurin requests trade: Top landing spots as Commanders' WR seeks exit amid stalled contract talks,2025-08-01 04:46:44,2,0.08076215793507574
"Terry McLaurin trade request, explained: Commanders WR asks out amid contract dispute",2025-08-01 04:44:53,2,0.13861543813722946
"Padres continue massive deadline upgrade with trade for Orioles' Ryan O'Hearn, Ramón Laureano",2025-08-01 04:43:30,2,0.1334187250111264
