title,published_at,NMF_topic,NMF_score
Lakers' LeBron James Facing New Retirement Report Amid Rumors,2025-07-17 02:58:15,2,0.10078185693919212
Samsung Certified Re-Newed Unlocked Phone Deal w/ Trade In (Minimum $300 credit w/ Eligible Trade-Ins) on various models. Shipping is free. (12 replies),2025-07-17 02:52:48,1,0.045756378887896104
Wall Street Is Rattled As Trump Muses About Firing Powell But Is 'Unlikely' To Do It,2025-07-17 02:41:21,1,0.05311837795148286
Why Bradley Beal and the Clippers needed each other after veteran flamed out with Suns,2025-07-17 02:37:53,2,0.017085484471264116
There's a potential solution to Shemar Stewart's contract drama with Bengals,2025-07-17 02:33:57,2,0.04341418860498339
Wall Street is rattled as Trump says he discussed firing Powell but is 'unlikely' to do it,2025-07-17 02:30:40,1,0.0797654066830213
Trump’s ultimatum isn’t an ultimatum – and Moscow knows it,2025-07-17 02:29:37,1,0.0017649209666350527
Stocks End Higher Despite Uncertainty About Possible Powell Firing,2025-07-17 02:27:46,2,0.0114563495696285
Trump says he ‘talked about the concept of firing’ Jerome Powell. Stocks went for a ride,2025-07-17 02:24:34,1,0.07732830538602121
"NVIDIA’s H20 AI Chip Ban Was Reportedly Lifted to Counter Huawei’s Rising Influence in China and Beyond, Threatening U.S. Dominance",2025-07-17 02:09:11,2,0.020564681381621177
Cubs Offseason Addition Doesn't Advance Extension Talks In Recent Comments,2025-07-17 02:00:08,2,0.03934087677518908
Russia’s Recognition Could Bolster Taliban Regime,2025-07-17 01:42:59,2,0.003431591594951595
Clippers land 3-time All-Star Bradley Beal in stunning post-buyout move from Suns: report,2025-07-17 01:28:26,2,0.05258635212055091
Mavericks make bold decision on possible LeBron James trade,2025-07-17 01:28:12,2,0.14562180273875847
Cubs should target blockbuster trade for Twins All-Star starting pitcher,2025-07-17 01:26:17,2,0.13453584536131022
Trade Deadline Outlook: Arizona Diamondbacks,2025-07-17 01:22:55,2,0.18307301237943283
"Faced with geopolitics and trade war, US companies in China report record-low new investment plans",2025-07-17 01:20:21,2,0.12648993289389512
"Coffee Tariff Updates On Brazil, Indonesia and China",2025-07-17 01:20:21,1,0.08262638178405578
What we should make of Trump's surprising pivot on Ukraine,2025-07-17 01:13:09,2,0.039726252452978505
Not a joke — deported to where?! US sends immigrants from Cuba and Jamaica to African Nation Eswatini,2025-07-17 01:04:04,2,0.0089188084257471
Trump Embraces State Capitalism,2025-07-17 01:00:43,1,0.06296078886019127
You can save $150 on the OnePlus 13 at Amazon right now - but there's a catch,2025-07-17 01:00:14,2,0.006284384147028857
Popular AI stock tanks after surprise tariff hit,2025-07-16 23:17:00,1,0.028229483679900115
Experts Reveal Lakers’ Definitive Stance on LeBron James Trade,2025-07-17 01:00:00,2,0.0969636679727216
Knicks face significant second apron decisions for 2026-27 NBA season,2025-07-17 00:58:00,2,0.021887565745080433
Prologis Reports Another Strong Quarter as Tariff Uncertainty Lingers,2025-07-17 00:56:09,1,0.024378839914493997
Red Sox's $21 Million Pitcher Listed As Potential Trade Chip Ahead Of Deadline,2025-07-17 00:53:01,2,0.23116184610316284
"Tariffs, Deals And Breakup Rumors Are Heating Up The Food Industry",2025-07-17 00:51:45,2,0.037890429727338984
Agent's Take: Breaking down exactly why Bengals' Shemar Stewart remains only unsigned 2025 first-round pick,2025-07-17 00:45:56,2,0.006069517097985249
Got buyer's remorse with your 8GB graphics card? Nvidia's AI texture compression promises huge benefits for GPUs with stingy amounts of memory,2025-07-17 00:45:00,2,0.002503728211961642
We Love the Samsung Galaxy Z Flip 5 and It’s Down to an All-Time Low of $776 at Amazon,2025-07-17 00:36:00,2,0.002544397128967496
07/16/2025,2025-07-17 00:30:00,1,0.0
Goldman's CEO is finding his groove after years of challenges. Here are 4 reasons David Solomon is optimistic.,2025-07-17 00:26:22,2,0.004666209437753216
"NATO warns India, China, Brazil of 100% sanctions over Russia trade",2025-07-17 00:24:37,2,0.06094145512164066
Corporate turnaround artist Jim Lanzone is “sticking to what users need” as CEO of Yahoo,2025-07-17 00:24:21,1,0.0017976906154885631
"Padres make Leo De Vries, Ethan Salas decisions ahead of deadline",2025-07-17 00:24:01,2,0.11733322888203389
"Fanatics Accused of Conspiring With Leagues, Unions on High Card Prices",2025-07-17 00:20:22,1,0.0006871855667417604
Main Street Action Joins $50M Battleground Alliance to Flip the House,2025-07-17 00:18:23,3,0.00725278944114292
"Faced with geopolitics and trade war, US companies in China report record-low new investment plans",2025-07-17 00:09:22,2,0.12648993289389512
Bucks trade proposal nets massive return for two-time MVP Giannis Antetokounmpo,2025-07-17 00:05:57,2,0.06321868264200793
Mariners tabbed as World Series contenders after strong first half,2025-07-17 00:05:16,2,0.015660124094564347
Duty Dilemma: India Inc's American dream on hold as tariff talks drag,2025-07-17 00:04:41,3,0.10171025329556509
Padres predicted to get 'creative' at trade deadline amid barren farm system,2025-07-17 00:02:50,2,0.19802848165363568
"Daunted by geopolitics and trade war, US companies in China report record-low new investment plans",2025-07-17 00:01:25,2,0.12648993289389512
Tigers trade pitch moves Jackson Jobe and more for $120 million All-Star,2025-07-16 23:57:43,2,0.1122260636078049
Clippers Beat Out Rival Lakers for 3-Time All- Star Bradley Beal,2025-07-16 23:51:06,2,0.046584805380866595
"NATO Chief Warns Brazil, China, India to Stop Doing Business with Russia",2025-07-16 23:41:57,1,0.01819075762801955
Los Angeles Clippers Signing 3x All-Star Scorer,2025-07-16 23:33:31,2,0.01754833695191309
Goldman Sachs profits jump as CEO eyes more merger activity,2025-07-16 23:32:32,1,0.004135431967103181
U.S.-India Trade Rapprochement Effort in the Face of New Tariffs,2025-07-16 23:30:47,2,0.0740234175026989
Goldman Sachs Profits Jump As CEO Eyes More Merger Activity,2025-07-16 23:30:26,1,0.004135431967103181
Rotorua developer Tony Bradley takes over stalled Victoria St project with Kāinga Ora,2025-07-16 23:30:00,2,0.0045573651845001945
Goldman Sachs profits jump as CEO eyes more merger activity,2025-07-16 23:28:34,1,0.004135431967103181
M&A Enforcement Easing Under The Trump Administration,2025-07-16 23:24:57,1,0.06473127994147508
U.S. producer prices unchanged as wholesale inflation cooled in May,2025-07-16 23:24:02,3,0.0014760430994166238
"US not just demanding market access, but plans to invest: RI",2025-07-16 23:21:42,2,0.020416459683307957
Reports: Indonesia Trade Deal Unlocks Massive Copper Access for U.S.,2025-07-16 23:19:01,1,0.10490951048897902
"Clippers to sign Bradley Beal to two-year deal after completion of contract buyout with the Suns, per report",2025-07-16 23:18:04,2,0.043598062856528556
Berserk's Best Anime Adaptation Gets Limited-Time Price Cut At Amazon,2025-07-16 23:18:00,2,0.017680153694207633
What a new contract for Terry McLaurin could look like as star WR puts Commanders on notice,2025-07-16 23:16:41,2,0.08860613408503486
Bitcoin Wavers After Trump Says He's 'Not Planning' to Fire Fed Chair,2025-07-16 23:16:41,1,0.08377028566818204
"Egypt, China sign deal for flagship industrial zone expansion",2025-07-16 23:16:00,1,0.047171139288145855
Bradley Beal's price was right for Clippers in West-altering decision,2025-07-16 23:15:31,2,0.02726117186629171
Aura Minerals Shares Mixed in US Debut After Oversubscribed Deal,2025-07-16 23:15:07,1,0.04618869286281861
The Wrecking of the FBI,2025-07-16 23:15:00,3,1.5542572577420633e-26
Bucks get bad news on signing All-Star guard as Damian Lillard replacement,2025-07-16 23:14:39,2,0.030395333150743515
Bradley Beal Will Reportedly Sign With Clippers After Buy Out from Suns,2025-07-16 23:13:46,2,0.03743859097693779
"Lakers miss out on 3-time All Star as West rival edges LeBron James, Luka Doncic for signing",2025-07-16 23:09:14,2,0.04744607504344609
"EU Drops Digital Tax, Clearing the Way for Apple and Other US Tech Giants",2025-07-16 05:21:30,1,0.01047710847231697
Asia stock markets today: live updates,2025-07-16 05:12:58,2,0.00786463064073268
This hypothetical Lakers trade sends away LeBron James to team up with old friends,2025-07-16 05:05:24,2,0.09408509476184904
"Video
Bag designer says cost of making products in U.S. is too high
5:00",2025-07-16 05:03:33,1,0.025851682791167212
Phillies linked to struggling former All-Star ahead of trade deadline,2025-07-16 04:50:05,2,0.20875838645502015
"After widespread slowdown, Port of LA import surge is a sign Trump’s ‘whipsaw’ tariffs sparked ‘one last’ stockpiling push, executive director says",2025-07-16 04:33:00,1,0.03381922330450311
Green Thumbs-Up from British Growers and Traders for UK-EU Plant Deal,2025-07-16 04:30:00,1,0.044453029795460335
Five Blockbuster Trades Phillies Should Make to Reach World Series,2025-07-16 04:28:50,2,0.07314267771225956
Asian Traders Tread With Caution as Fed Bets Wane: Markets Wrap,2025-07-16 04:28:25,1,0.002598413682898875
"Stock market today: Dow, S&P 500, Nasdaq tick up as Wall Street juggles tariffs, earnings, and inflation",2025-07-16 04:20:44,1,0.008385306091838383
"Stock market today: Dow, S&P 500 stall, Nasdaq futures slip as Fed rate cut bets wane",2025-07-16 04:20:44,1,0.014784896301716796
"Australian PM Talks Trade in China, Sidesteps Tensions With Xi",2025-07-16 04:18:52,2,0.0643307449695211
Accenture Song – WPP merger rumors swirl – but would it make sense?,2025-07-16 04:14:35,2,0.046561333203500005
"Most Canadians prefer ""hard approach"" in trade talks with Trump: survey",2025-07-16 04:12:00,2,0.08221942633932636
Wheat Closes with Mixed Trade on Tuesday,2025-07-16 04:07:57,2,0.06980747238947838
Canelo Alvarez vs. Hamzah Sheeraz In 2026?,2025-07-16 04:07:32,3,2.1401386147527592e-26
Soybeans Fall on Tuesday,2025-07-16 04:01:35,2,0.004999710968132953
Trump Says He Has a Trade Deal With Indonesia,2025-07-16 03:56:46,1,0.34532540336530126
Trump defends giving Putin '50 days' to make peace with Ukraine,2025-07-16 03:49:56,1,0.05653871240137507
U.S. says Nvidia's sales of AI chips to China are part of rare earths talks,2025-07-16 03:49:00,1,0.04023329911114539
"Kyrie Irving’s ACL rehab Ahead of schedule, says Mavericks GM Nico Harrison",2025-07-16 03:47:45,1,0.02092943922835395
Maple Leafs eye Erik Karlsson in bold blue line shake-up trade idea,2025-07-16 03:40:32,2,0.04708530645367236
Can Shemar Stewart return to college? Explaining potential options for Bengals pass rusher during contract holdout,2025-07-16 03:32:45,2,0.037480809594491286
Trump says Indonesia to face 19 percent tariff under trade deal - Economy - The Jakarta Post,2025-07-16 03:29:49,1,0.20965436804641593
Phillies get projected trade cost to land Guardians' Emmanuel Clase,2025-07-16 03:27:56,2,0.09345164904085833
"Nasdaq edges to record as Dow, S&P 500 retreat",2025-07-16 03:24:44,2,0.0057835278508400895
"Nvidias resumption of AI chips to China is part of rare earths talks, says US",2025-07-16 03:23:15,1,0.032090830636377736
Could Bitcoin finally be ‘mooning’? (Paul Quickenden),2025-07-16 03:23:07,1,0.0014730263809061448
Turkey’s Regional Power Push,2025-07-16 03:22:04,2,0.002561293052863978
The lie at the heart of Trump’s entire economic agenda,2025-07-16 03:08:38,1,0.0027695687241951605
Eight Books on Focus,2025-07-16 03:07:31,2,0.00036948430569961905
Trump Broke the Left and Exposed Its Dirty Playbook,2025-07-16 03:07:14,1,0.04539332102000769
Trump sets 19% tariff on Indonesia goods in latest deal; EU readies retaliation,2025-07-16 03:05:23,1,0.12540673595622925
Trump Trade Deal Revealed: Indonesia Shoe Imports to US Will Face 19 Percent Tariff Rate,2025-07-16 03:01:14,1,0.21121116896487974
America’s only rare earth producer gets a boost from Apple and Pentagon agreements,2025-07-16 02:49:36,3,0.015323095998155017
America’s only rare earth producer gets a boost from Apple and Pentagon agreements,2025-07-16 02:49:36,3,0.015323095998155017
Trump Promised to End Inflation. He’s Bringing It Back Instead.,2025-07-16 02:48:20,1,0.060324548872514656
Fyodor Lukyanov: Here’s the fundamental difference between Russian and US strategy towards Ukraine,2025-07-16 02:46:01,1,0.007057465165011347
Rachel Reeves Mansion House 2025 speech,2025-07-16 02:45:16,2,0.0026827068405001716
Bucks need to consider reunion with free agent former Milwaukee standout,2025-07-16 02:43:30,2,0.01489228178005937
"Eli Manning backs out of Giants ownership purchase, Darren Waller seeks sunnier skies with Dolphins",2025-07-16 02:42:00,2,0.005516065878433822
Xi Jinping reinforces China’s military rights in meeting with Albanese,2025-07-16 02:35:21,2,0.004175398714089154
Stocks Fade as Expectations are Trimmed for Fed Rate Cut in September,2025-07-16 02:32:41,1,0.014044838294300956
World Energy Report Exposes Looming Resource Crises,2025-07-16 02:30:00,2,0.018699469836039064
Moishe Mana scores $150M refi for 56-property portfolio in Miami’s Wynwood,2025-07-16 02:30:00,2,0.00039565656943998175
Trump announces 19 percent tariff on Indonesia,2025-07-16 02:29:29,1,0.25012301546130605
China Gets NVIDIA AI Chips Again as US Approves Sales,2025-07-16 02:18:38,2,0.015251565857778942
"Colorado’s Roger Hutson tried to keep Trump from a second term. But six months in, he’s ‘very impressed.’ (Opinion)",2025-07-16 02:17:18,1,0.0491082850282655
Why Padres 'Trade Deadline Dream Scenario' Makes Perfect Sense For San Diego,2025-07-16 02:00:01,2,0.10315902202866076
"US Trade Wars Will Hit Households Worldwide, BOE’s Bailey Warns",2025-07-16 01:54:03,2,0.0541011781609155
Most Canadians prefer tough approach in trade talks with Trump: survey,2025-07-16 01:50:54,2,0.06644782832722014
Lakers Receive Update Regarding Luka Doncic's Contract Situation,2025-07-16 01:46:25,2,0.041007781814180834
Portman Ridge Finance Corporation Closes Merger with Logan Ridge Finance Corporation,2025-07-16 01:45:00,2,0.002155115564568557
The cost of Moscow’s war,2025-07-16 01:45:00,2,0.005542988223317414
"Trump: Indonesia Agrees to Pay 19 Percent Tariff, Open Up Market to U.S. in Trade Deal",2025-07-16 01:44:51,1,0.12236263959976262
"Stock market today: Dow slides after CPI inflation accelerates, Nvidia's surge lifts Nasdaq to record",2025-07-16 01:39:55,2,0.006174590979190438
Trump announces trade deal with Indonesia,2025-07-16 01:39:12,1,0.3556449258879278
Embraer Says Impact of Trump Tariffs Could Rival Covid,2025-07-16 01:32:21,1,0.09861629988329557
EU demands more action from Israel on aid deal as strikes in Gaza continue,2025-07-16 01:21:29,1,0.05415019267194966
Trump claims tariff deal with Indonesia,2025-07-16 01:17:58,1,0.24669332120209292
India's Top Diplomat Visits China for First Time in 6 Years for Trade and Security Talks,2025-07-16 01:17:17,2,0.06880652079451223
MLB Writer Expects Rangers To Cut Ties With All-Star Slugger In Monster Trade,2025-07-16 01:14:01,2,0.12852305181731652
EU backs Trump Ukraine U-Turn but wants US to 'share burden',2025-07-16 01:14:00,1,0.08711174678515701
Trump to 'refine trade deal' with UK,2025-07-16 01:08:00,1,0.13663426514046
"Crude Falls Amid Stronger Dollar, Supply Risk Doubts",2025-07-16 01:00:08,2,0.015317160660225402
"Report: Steelers, TJ Watt Facing Major Issue in Contract Discussions",2025-07-16 00:54:23,2,0.030951666178619792
"US banking giants reap gains from dealmaking rebound, trading bump",2025-07-16 00:52:24,2,0.010155610739818742
Padres' Jackson Merrill makes NSFW remark on play before All-Star break,2025-07-16 00:51:53,2,0.01209948963103008
"Trump's new trade deal promises billions to the U.S. — plus, reasons behind the mixed market",2025-07-16 00:47:48,1,0.06576236852838811
"Trump says trade deal with Indonesia 'great deal, for everybody'",2025-07-16 00:47:39,1,0.34532540336530126
Former Bucks guard Vasilije Micic signs lucrative deal with EuroLeague powerhouse,2025-07-16 00:47:36,1,0.036563887952568465
'We will keep delivering!' Trump touts 'landmark deal' with new steep tariff,2025-07-16 00:35:02,1,0.10132508826272088
Consider the lobster: A crustacean's voyage through Donald Trump's trade chaos,2025-07-16 00:30:00,2,0.05983785493793772
Trump announces trade deal with Indonesia,2025-07-16 00:25:28,1,0.3556449258879278
Bengals in contract standoff with Trey Hendrickson: Breaking down where things stand going into training camp,2025-07-16 00:15:34,2,0.026117095979196085
Aiarty Rescues Your Noisiest Footage and Photos from the Darkest Scenes,2025-07-16 00:13:40,3,2.7783882564443187e-26
Indonesia signs up for 50 Boeing jets as Trump imposes 19 percent tariff on goods,2025-07-16 00:09:32,1,0.11385148623528443
"Trump Announces Trade Deal With Indonesia, Opening Entire Market to U.S.",2025-07-16 00:09:28,1,0.19075005959280864
Omnicom Remains On Track to Close IPG Deal This Year,2025-07-16 00:09:19,1,0.04562776783327843
Red Sox Blockbuster? Why Latest Alex Bregman Trade Rumors Make No Sense,2025-07-16 00:09:01,2,0.18003761460854342
Steel producers warn of dire consequences of U.S. trade deal with tariffs,2025-07-16 00:03:19,1,0.0713942097979363
America’s only rare earth producer gets a boost from Apple and Pentagon agreements,2025-07-15 23:59:36,3,0.015323095998155017
Delay on health labelling on alcohol comes amid uncertain trading environment,2025-07-15 23:57:42,2,0.019073865348751558
America's only rare earth producer gets a boost from Apple and Pentagon agreements,2025-07-15 23:55:21,3,0.015323095998155017
"Trade Talks: Trump Says Will Have Access Into India, Working On Same Line As Indonesia",2025-07-15 23:40:38,1,0.15654894105684883
Congress collects MPs’ signatures for impeachment motion against Justice Yashwant Varma,2025-07-15 23:33:38,1,0.0002724708689579804
How Trump Can Turn Ukraine Around,2025-07-15 23:33:10,1,0.09624238975090846
"[Latest] Global Recycled Ocean Plastics Market Size/Share Worth USD 3.50 Billion by 2034 at a 6.81% CAGR: Custom Market Insights (Analysis, Outlook, Leaders, Report, Trends, Forecast, Segmentation, Growth Rate, Value, SWOT Analysis)",2025-07-15 23:31:00,1,0.01135168676472736
Trump Says Indonesia To Face 19% Tariff Under Trade Deal,2025-07-15 23:30:27,1,0.3165757962187035
"China growth pings, A US tariff playbook?",2025-07-15 23:29:22,1,0.05903485768974091
"NATO Chief Warns India, China and Brazil Of Secondary Sanctions Over Russia Links",2025-07-15 23:28:24,1,0.014748908704986899
Federal judge halts CFPB rule to remove medical debt from credit reports,2025-07-15 23:26:56,2,0.0017023096433159423
Carney says US-Canada trade deal likely to include some tariffs,2025-07-15 23:19:34,1,0.12633142257011717
Terry McLaurin landing spots: Potential trade suitors as WR frustrated with Commanders amid contract dispute,2025-07-15 23:18:05,2,0.13451770406836405
Tesla launches Model Y in India with elevated price tag amid high tariffs,2025-07-15 23:13:05,1,0.01628252562711647
Terry McLaurin ‘frustrated’ with contract status ahead of Commanders training camp,2025-07-15 23:12:26,2,0.08495469624567677
"Manhattan, Chicago Murder Rates Plunge in 2025, Officials Say",2025-07-15 23:08:05,2,0.005003295077703705
Trump throws gauntlet down on Putin — who gambled he could stall his way to victory,2025-07-15 04:55:02,1,0.04273340823905101
US imposes a 17% duty on Mexican tomatoes in hopes of boosting domestic production,2025-07-15 04:43:29,3,0.4073548969689513
Fresh Mexican tomatoes singled out for 17% tariff,2025-07-15 04:41:05,3,0.37996882489944545
"Indian exports to US to be more competitive after tariff hike on China, other countries: Niti Aayog",2025-07-15 04:40:00,1,0.025930152556839278
Brook Lopez could see a potential 'twin towers' role with Ivica Zubac on Clippers,2025-07-15 04:33:26,2,0.020352090200407798
US tariffs of 30% could accelerate job losses - Tánaiste,2025-07-15 04:30:01,1,0.023995120409097487
US Imposes Major Duty On Fresh Mexican Tomatoes To Boost Domestic Production,2025-07-15 04:09:38,3,0.465584142530177
"Deal-making across Wall Street is ramping up, Jim Cramer says",2025-07-15 04:08:53,1,0.03445775194930005
Why Trump Suddenly Sounds Tougher on Russia,2025-07-15 04:02:00,1,0.06163920589173599
US announces 17% tariff on Mexican tomato imports,2025-07-15 03:51:31,3,0.14460337319398955
US imposes a 17% duty on fresh Mexican tomatoes in hopes of boosting domestic production,2025-07-15 03:38:44,3,0.46435022284739313
"Rollins Slams Medicaid, Touts Healthy Food to Cut Health Care Costs—GOP Cut Both Programs",2025-07-15 03:37:48,2,0.014597593048446104
"Trump’s new Ukraine plan, briefly explained",2025-07-15 03:36:14,2,0.017355971845842463
Trump administration imposes 17% tariff on fresh Mexican tomatoes,2025-07-15 03:35:00,3,0.4653041508686688
"Trump sours on Putin, but bromance may not be over",2025-07-15 03:31:00,1,0.06991077551820195
Trade Desk's stock jumps on S&P 500 inclusion as Ansys exits index due to acquisition,2025-07-15 03:28:45,2,0.04760034473127872
"DEAL: Save $720 on Galaxy Z Flip 7, Free Upgraded Storage Included",2025-07-15 03:27:26,2,0.011955194521055234
"EU trade ministers call Trump’s 30% tariff ‘absolutely unacceptable,’ plan countermeasures",2025-07-15 03:19:59,1,0.06633279630513568
Trump threatens Russia with tariffs while unveiling new Ukraine weapons plan,2025-07-14 23:34:03,1,0.08746758235046964
China exports beat forecasts in June after U.S. tariff truce,2025-07-15 03:07:03,1,0.03290863859820823
Japan ruling party support plunges ahead of national election in NHK poll,2025-07-15 03:02:58,1,0.022374229362272076
Trump Threatens Secondary Tariffs Against Russia’s Trade Partners,2025-07-15 03:02:46,1,0.11953435984962252
EU threatens countermeasures over U.S. tariffs; Trump says he is open to talks,2025-07-15 02:57:33,1,0.1255339182998106
Trump threatens Russia with 100% tariffs if war on Ukraine isn't resolved within 50 days,2025-07-15 02:57:08,1,0.08973484720024599
US imposes a 17% duty on fresh Mexican tomatoes,2025-07-15 02:56:50,3,0.5708167947974281
"S&P 500 Gains & Losses Today: EQT Stock Jumps, Modelo Maker Constellation Drops",2025-07-15 02:55:45,1,0.005579827027932949
George Pickens predicted to sign $76 million contract after trade from Steelers to Cowboys,2025-07-15 02:54:52,2,0.14504372629341603
Censorship for Citizenship,2025-07-15 02:53:00,3,1.5542572577420633e-26
"Mexico, EU Tariff Threats Follow Double Digit Trend: How Shoe Firms Are Responding",2025-07-15 02:52:42,1,0.03779940410395963
Yankees Pushed To Swing 'Emergency Trade' For $13.5 Million Ace,2025-07-15 02:51:37,2,0.08794550313790282
Soybeans Weakness Continues on Monday,2025-07-15 02:45:37,2,0.0001634839226011818
US imposes a 17% duty on fresh Mexican tomatoes,2025-07-15 02:42:27,3,0.5708167947974281
US imposes a 17% duty on fresh Mexican tomatoes,2025-07-15 02:42:25,3,0.5708167947974281
US imposes a 17% duty on fresh Mexican tomatoes,2025-07-15 02:39:32,3,0.5708167947974281
US imposes a 17% duty on fresh Mexican tomatoes,2025-07-15 02:39:32,3,0.5708167947974281
"Cooper, Drake, and Klay: 7 wild NBA Offseason Storylines",2025-07-15 02:39:00,2,0.01103598225876437
"Samsung Has Secured A Decisive Win In Its OLED Trade Secret Infringement Case Against China’s BOE – A Major Blow For Apple, Which Now Risks Higher iPhone 17e Production Costs",2025-07-15 02:36:42,2,0.0385404536398982
Xi and Albanese to meet — with some touchy topics on the agenda,2025-07-15 02:32:37,2,0.002934324891524578
"Fox News Politics Newsletter: Biden Chief of Staff OK'd Autopen Pardons, Email Reveals",2025-07-15 02:31:59,2,0.006732322307541748
San Francisco 49ers in crisis as Jauan Jennings demands more money or walks away,2025-07-15 02:26:36,2,0.006976230290231888
"EU to hit US aircraft, cars and food in latest retaliatory strike",2025-07-15 02:17:35,2,0.020972805805534716
Trump Threatens Moscow With Tariffs If No Ukraine Deal In 50 Days,2025-07-15 02:13:57,1,0.1472354142963788
Stocks Rebound as Trump Says He’s Open to Trade Talks,2025-07-15 02:09:10,1,0.1334099244780398
"Trump's latest tariff salvo fuels economic uncertainty, experts say",2025-07-15 02:07:54,1,0.024479366711798126
Rookie Hugo Gonzalez reveals two favorite Celtics growing up,2025-07-15 02:02:19,2,0.011704656075270558
LeBron James Sends Message to Cavaliers Executive Amid Trade Speculation,2025-07-15 01:58:47,2,0.10093346277993617
"Almost half of young workers expected to work unpaid overtime, while a quarter aren’t paid compulsory super",2025-07-15 01:39:31,2,0.0054123642481153185
Red Sox Predicted to Cut Ties With Jarren Duran After $200M Alex Bregman Update,2025-07-15 01:37:33,2,0.09656314656613012
"Stock market today: Nasdaq secures record close as investors shake off tariff threats, eye key inflation data",2025-07-15 01:30:46,1,0.028340284417491035
Dementia Don: My Tariff Threatening Letters Are 'The Deals',2025-07-15 01:30:02,1,0.0320596457739027
Most important non-QB for every NFL team: These players will go a long way in determining their club's success,2025-07-15 01:25:33,2,0.013036450174295035
Did Windsurf Sell Too Cheap? The Wild 72-Hour Saga and AI Coding Valuations,2025-07-15 01:18:59,2,0.0022523990294065683
Pension fund Previ sells stake in Brazil's BRF ahead of Marfrig deal,2025-07-15 01:16:29,1,0.03502282264943848
MLB writer proposes crazy Cardinals' Sonny Gray Red Sox trade,2025-07-15 01:14:50,2,0.12213032335374849
Mavericks officially make $54 million decision as trade questions loom,2025-07-15 01:14:45,2,0.15402276027337883
Yankees’ trade targets include 5 Pittsburgh Pirates players,2025-07-20 21:19:51,2,0.06690076453150612
Port of LA sees record freight in trade war whipsaw to beat tariffs,2025-07-15 01:13:31,2,0.0439979813775145
Insider reveals Celtics' Anfernee Simons trade plan as questions mount,2025-07-15 01:12:03,2,0.07343398562347267
Heat considered favorites for 9-time All-Star and Celtics' target for one reason,2025-07-15 01:08:05,2,0.012875285503693924
